id,platform,source_app,title,description,tools_tags,category,url,scraped_date,is_new
Zoho CRM,zapier,zoho-crm,Zoho CRM,Zoho CRM is an AI-powered sales CRM that empowers teams to work together better and close more deals.,Premium,app_listing,https://zapier.com/apps/zoho-crm/integrations,2025-07-31,true
Storage by Zapier,zapier,storage-by-zapier,Storage by Zapier,Quickly store and retrieve small values of data. Allows you to reference data between Zap runs or share data between different Zaps.,Free,app_listing,https://zapier.com/apps/storage-by-zapier/integrations,2025-07-31,true
Facebook Conversions,zapier,facebook-conversions,Facebook Conversions,Facebook’s Conversions lets you send information about important customer events to Facebook Server-Side API directly from your website’s server, CRM or other customer information databases. This information is useful to create powerful ads that yield better conversions.,Free,app_listing,https://zapier.com/apps/facebook-conversions/integrations,2025-07-31,true
Telegram,zapier,telegram,Telegram,Telegram is a cloud-based instant messaging and voice over IP service developed by Telegram Messenger LLP.,Free,app_listing,https://zapier.com/apps/telegram/integrations,2025-07-31,true
Stripe (Legacy),zapier,stripe-legacy,Stripe (Legacy),Stripe is a developer-friendly way to accept payments online and in mobile apps. Stripe's suite of APIs powers commerce for thousands of companies of all sizes, processing billions of dollars for businesses each year.,Free,app_listing,https://zapier.com/apps/stripe-legacy/integrations,2025-07-31,true
Xero,zapier,xero,Xero,Xero is an accounting app that lets you track businesses expenses and accounting with intuitive mobile apps and web interfaces for point-of-sale, ecommerce, time-tracking, and more.,Premium,app_listing,https://zapier.com/apps/xero/integrations,2025-07-31,true
WordPress,zapier,wordpress,WordPress,WordPress is web software you can use to create a beautiful website or blog. Nearly 20% of the top 10 million websites and over 60 million people have chosen WordPress to power the place on the web they call "home".,Free,app_listing,https://zapier.com/apps/wordpress/integrations,2025-07-31,true
Weather by Zapier,zapier,weather-by-zapier,Weather by Zapier,Trigger off weather conditions in your local area. (Powered by Weather Machine),Free,app_listing,https://zapier.com/apps/weather-by-zapier/integrations,2025-07-31,true
Microsoft Teams,zapier,microsoft-teams,Microsoft Teams,Microsoft Teams is the hub for teamwork in Office 365 that integrates all the people, content, and tools your team needs to be more engaged and effective.,Free,app_listing,https://zapier.com/apps/microsoft-teams/integrations,2025-07-31,true
Square,zapier,square,Square,Square creates tools that help sellers of all sizes start, run and grow their businesses. Square’s point-of-sale service offers tools for every part of running a business, from accepting credit cards and tracking inventory to real-time analytics and invoicing.,Free,app_listing,https://zapier.com/apps/square/integrations,2025-07-31,true
Follow Up Boss,zapier,follow-up-boss,Follow Up Boss,Simple lead management software for real estate agents and brokers. Follow Up Boss takes all your leads and puts them in one simple system automatically. Helps you to respond fast and convert more leads into closings.,Free,app_listing,https://zapier.com/apps/follow-up-boss/integrations,2025-07-31,true
Microsoft To Do,zapier,microsoft-to-do,Microsoft To Do,Microsoft To Do is an intelligent task management app that makes it easy to plan and manage your day. With its intelligent Suggestions, To Do removes all the clutter and empowers you to focus on what's important, when it's important.,Free,app_listing,https://zapier.com/apps/microsoft-to-do/integrations,2025-07-31,true
Zendesk,zapier,zendesk,Zendesk,Zendesk is a web-based help desk support tool that makes it simple to provide great customer support.,Premium,app_listing,https://zapier.com/apps/zendesk/integrations,2025-07-31,true
Instagram for Business,zapier,instagram-for-business,Instagram for Business,Instagram for Business allows you to gain insights on your followers. Instagram keeps rolling out tools to help business owners succeed on the photo-sharing social media platform.,Free,app_listing,https://zapier.com/apps/instagram-for-business/integrations,2025-07-31,true
ThriveCart,zapier,thrivecart,ThriveCart,ThriveCart is the no. 1 cart software that grows your income from existing traffic.,Free,app_listing,https://zapier.com/apps/thrivecart/integrations,2025-07-31,true
Zapier Manager,zapier,zapier-manager,Zapier Manager,Bolster your Zap housekeeping with Zapier Manager. Track Zap errors, invite members to your Team, and more!,Free,app_listing,https://zapier.com/apps/zapier-manager/integrations,2025-07-31,true
Buffer,zapier,buffer,Buffer,Manage your social media marketing together with Buffer's tools to schedule posts, analyze performance, and publish to a half-dozen social networks from one app.,Free,app_listing,https://zapier.com/apps/buffer/integrations,2025-07-31,true
WPForms,zapier,wpforms,WPForms,WPForms is a drag and drop online form builder for WordPress that allows you to easily create contact forms, email subscription forms, billing forms, donation forms, online order forms, and more.,Free,app_listing,https://zapier.com/apps/wpforms/integrations,2025-07-31,true
Sub-Zap by Zapier,zapier,sub-zap-by-zapier,Sub-Zap by Zapier,Build reusable Zap components and systems by building and calling "Sub-Zaps".,Premium,app_listing,https://zapier.com/apps/sub-zap-by-zapier/integrations,2025-07-31,true
Skool,zapier,skool,Skool,Skool is a simple to use community platform that allows you to put your community, course, and event schedule together in one place.,Free,app_listing,https://zapier.com/apps/skool/integrations,2025-07-31,true
Manychat,zapier,manychat,Manychat,Manychat is an all-in-one Messenger Marketing platform. Create your Facebook Messenger bot for marketing, sales and support with our simple drag'n'drop builder. Effectively promote with built-in tools for growing audience. Start today – it's easy and free.,Free,app_listing,https://zapier.com/apps/manychat/integrations,2025-07-31,true
Zapier Interfaces,zapier,zapier-interfaces,Zapier Interfaces,Instantly build dynamic interfaces that connect to Zaps and a data source (like Tables). Interfaces gives you a drag-and-drop way to build visual workflows for any business process, without writing code.,Free,app_listing,https://zapier.com/apps/zapier-interfaces/integrations,2025-07-31,true
Constant Contact,zapier,constant-contact,Constant Contact,Constant Contact can help grow your business with an email marketing tool that’s affordable, powerful, and easy to use.,Free,app_listing,https://zapier.com/apps/constant-contact/integrations,2025-07-31,true
LinkedIn Ads,zapier,linkedin-ads,LinkedIn Ads,LinkedIn Ads allows marketers to collect even more quality leads from their ads and events on LinkedIn with seamless pre-filled forms.,Premium,app_listing,https://zapier.com/apps/linkedin-ads/integrations,2025-07-31,true
Strava,zapier,strava,Strava,Strava is a fitness tracking application.,Free,app_listing,https://zapier.com/apps/strava/integrations,2025-07-31,true
Fathom,zapier,fathom,Fathom,Fathom combines an AI meeting assistant that improves the productivity of your team with a conversational intelligence platform.,Free,app_listing,https://zapier.com/apps/fathom/integrations,2025-07-31,true
PandaDoc,zapier,pandadoc,PandaDoc,PandaDoc is an all-in-one software that streamlines your sales workflows. Create, send, track, and eSign client-facing documents designed to win more business.,Free,app_listing,https://zapier.com/apps/pandadoc/integrations,2025-07-31,true
Docusign,zapier,docusign,Docusign,Docusign is an electronic signature technology and digital transaction management service for facilitating electronic exchanges of signed documents.,Free,app_listing,https://zapier.com/apps/docusign/integrations,2025-07-31,true
ClickFunnels Classic,zapier,clickfunnels-classic,ClickFunnels Classic,Create beautiful landing pages and complete marketing funnels.,Free,app_listing,https://zapier.com/apps/clickfunnels-classic/integrations,2025-07-31,true
Zapier Chatbots,zapier,zapier-chatbots,Zapier Chatbots,Create custom AI chatbots and take action with built-in automation,Free,app_listing,https://zapier.com/apps/zapier-chatbots/integrations,2025-07-31,true
Eventbrite,zapier,eventbrite,Eventbrite,Eventbrite is an event management tool that makes it simple to create, manage, promote, and sell out your event.,Free,app_listing,https://zapier.com/apps/eventbrite/integrations,2025-07-31,true
Dubsado,zapier,dubsado,Dubsado,Dubsado is a platform that streamlines your client flow. Create repeatable processes, send contracts, get paid... and so much more.,Free,app_listing,https://zapier.com/apps/dubsado/integrations,2025-07-31,true
Google AI Studio (Gemini),zapier,google-ai-studio-gemini,Google AI Studio (Gemini),Google AI Studio is a fast, easy way to start prototyping generative AI ideas using Google's Gemini model.,Free,app_listing,https://zapier.com/apps/google-ai-studio-gemini/integrations,2025-07-31,true
Unbounce,zapier,unbounce,Unbounce,Unbounce is a landing page platform that helps you convert more visitors into leads, sales, and customers. Unbounce Conversion Intelligence™ is AI powered-functionality that works with your marketing intuition to ensure the best campaign performance every time.,Free,app_listing,https://zapier.com/apps/unbounce/integrations,2025-07-31,true
LinkedIn,zapier,linkedin,LinkedIn,LinkedIn is the world's largest social network for professionals. Manage your professional identity. Build and engage with your professional network. Access knowledge, insights and opportunities.,Free,app_listing,https://zapier.com/apps/linkedin/integrations,2025-07-31,true
Intercom,zapier,intercom,Intercom,Intercom is the Engagement OS, an open channel between customer and business that is in the product, in the moment, and on their terms. We break down silos, unifying data and systems to create an ongoing dialogue, so companies can make the most of every opportunity.,Free,app_listing,https://zapier.com/apps/intercom/integrations,2025-07-31,true
OneDrive,zapier,onedrive,OneDrive,OneDrive, Microsoft's file sync app formerly known as SkyDrive, lets you store your files online, edit Office documents in the free Office Web Apps, and easily access your online files from your PC.,Free,app_listing,https://zapier.com/apps/onedrive/integrations,2025-07-31,true
Close,zapier,close,Close,Close is a sales productivity platform built to help you close more deals. With built-in calling, SMS, and email—your team can communicate with prospects and customers all in one place. It’s an "all-in-one" platform which you can use standalone without needing any other sales emails tools or calling products.,Free,app_listing,https://zapier.com/apps/close/integrations,2025-07-31,true
Thinkific,zapier,thinkific,Thinkific,The all-in-one platform to create, market & sell your online courses. Deliver beautiful courses on your own site, with no technical or design experience required!,Free,app_listing,https://zapier.com/apps/thinkific/integrations,2025-07-31,true
Google Chat,zapier,google-chat,Google Chat,Google Chat is a communication software developed by Google built for teams that provides direct messages and team chat rooms, along with a group messaging function that allows Google Drive content sharing.,Free,app_listing,https://zapier.com/apps/google-chat/integrations,2025-07-31,true
Circle,zapier,circle,Circle,A modern community platform for creators.,Free,app_listing,https://zapier.com/apps/circle/integrations,2025-07-31,true
Facebook Lead Ads (for Business admins),zapier,facebook-lead-ads-for-business-admins,Facebook Lead Ads (for Business admins),Facebook lead ads make signing up for business information easy for people and more valuable for businesses. The Facebook lead ad app is useful for marketers who want to automate actions on their leads.,Premium,app_listing,https://zapier.com/apps/facebook-lead-ads-for-business-admins/integrations,2025-07-31,true
systeme.io,zapier,systeme-io,systeme.io,Systeme.io allows you to build sales funnels, send emails and automate your entire business.,Free,app_listing,https://zapier.com/apps/systeme-io/integrations,2025-07-31,true
OpenPhone,zapier,openphone,OpenPhone,OpenPhone is a new phone for business. It comes with powerful calling, messaging, and a lightweight CRM.,Free,app_listing,https://zapier.com/apps/openphone/integrations,2025-07-31,true
Motion,zapier,motion,Motion,Motion uses artificial intelligence to optimize your and your team’s day. It automatically prioritizes tasks, schedules meetings & resolves calendar conflicts.,Free,app_listing,https://zapier.com/apps/motion/integrations,2025-07-31,true
Wave,zapier,wave,Wave,Wave's invoicing and accounting software is completely free, and has no usage limits or restrictions. Optional Payment Processing and Payroll services are fully integrated to create a seamless platform for your business finances.,Free,app_listing,https://zapier.com/apps/wave/integrations,2025-07-31,true
Cognito Forms,zapier,cognito-forms,Cognito Forms,Cognito Forms is an easy-to-use form builder that allows users to quickly build a form, include it on their website, and start capturing entries without having to do any development.,Free,app_listing,https://zapier.com/apps/cognito-forms/integrations,2025-07-31,true
tl;dv,zapier,tl-dv,tl;dv,tl;dv is an AI meeting note taker that let's you record, transcribe, and summarize your Google Meet and Zoom meetings,Free,app_listing,https://zapier.com/apps/tl-dv/integrations,2025-07-31,true
Microsoft Office 365,zapier,microsoft-office-365,Microsoft Office 365,Microsoft Office 365 Business is a complete office suite in the cloud. It provides all the standard office products like Excel, Outlook, Word, SharePoint and more, but available from any internet enabled computer!

Zapier does not currently support Outlook.com addresses or Home 365 accounts, only business or Enterprise.,Free,app_listing,https://zapier.com/apps/microsoft-office-365/integrations,2025-07-31,true
TikTok Lead Generation,zapier,tiktok-lead-generation,TikTok Lead Generation,TikTok's Lead Generation enables businesses of all sizes to create seamless interactions to reach prospects in order to convert them into potential customers.,Free,app_listing,https://zapier.com/apps/tiktok-lead-generation/integrations,2025-07-31,true
URL Shortener by Zapier,zapier,url-shortener-by-zapier,URL Shortener by Zapier,Create ready-to-share links on the fly. Zapier's URL Shortener spits out a simplified version of any link you throw its way. Pass that link to Twitter, drop it in an email, or send it along to any Zapier-connected app.,Free,app_listing,https://zapier.com/apps/url-shortener-by-zapier/integrations,2025-07-31,true
GitHub,zapier,github,GitHub,GitHub is the perfect place to share code and work collaboratively on private and open source software.,Free,app_listing,https://zapier.com/apps/github/integrations,2025-07-31,true
HoneyBook,zapier,honeybook,HoneyBook,HoneyBook is the leading client-flow platform independent businesses use to showcase services, book clients, manage projects, and get paid.,Free,app_listing,https://zapier.com/apps/honeybook/integrations,2025-07-31,true
PDF.co,zapier,pdf-co,PDF.co,PDF.co is a set of tools for PDF file and data extraction. Get CSV out of pdf, spreadshets, barcodes, invoices. Also can split pdf, merge pdf, convert pdf.,Free,app_listing,https://zapier.com/apps/pdf-co/integrations,2025-07-31,true
TickTick,zapier,ticktick,TickTick,TickTick is a simple and effective to-do list and task manager app with seamless cloud synchronization across all your devices.,Free,app_listing,https://zapier.com/apps/ticktick/integrations,2025-07-31,true
Any.do Personal,zapier,any-do-personal,Any.do Personal,Any.do is a simple & powerful way to manage Projects, To-do lists & Reminders. Available on Web, iPhone, Android, Mac, Windows & More.,Free,app_listing,https://zapier.com/apps/any-do-personal/integrations,2025-07-31,true
Smartsheet,zapier,smartsheet,Smartsheet,Smartsheet is a leading cloud-based platform for work execution, enabling teams and organizations to plan, capture, manage, automate, and report on work at scale, resulting in more efficient processes and better business outcomes.,Free,app_listing,https://zapier.com/apps/smartsheet/integrations,2025-07-31,true
ClickSend SMS,zapier,clicksend-sms,ClickSend SMS,ClickSend is a cloud-based service that lets you send and receive SMS, Email, Voice, Fax and Letters worldwide.,Free,app_listing,https://zapier.com/apps/clicksend-sms/integrations,2025-07-31,true
Keap,zapier,keap,Keap,Keap is your all-in-one CRM, sales and marketing automation software that helps organize leads, land the job, get paid, and keep growing.,Free,app_listing,https://zapier.com/apps/keap/integrations,2025-07-31,true
RingCentral,zapier,ringcentral,RingCentral,RingCentral provides cloud-based communication system to modern businesses of all sizes. The system enables companies with voice, SMS, video, Fax, and team collaboration services on all major desktop and mobile platforms. All devices, services, and users can be managed through our PBX and administrative capability designed for Enterprise IT.,Free,app_listing,https://zapier.com/apps/ringcentral/integrations,2025-07-31,true
Fireflies.ai,zapier,fireflies-ai,Fireflies.ai,Automatic notes from every meeting. Fireflies dials into your call to take notes. Automate actions by setting custom commands and alerts.,Free,app_listing,https://zapier.com/apps/fireflies-ai/integrations,2025-07-31,true
Jobber,zapier,jobber,Jobber,Jobber is the command centre for home service businesses. Our easy-to-use app powers sales, operations, and customer service—all in one place.,Free,app_listing,https://zapier.com/apps/jobber/integrations,2025-07-31,true
Teachable,zapier,teachable,Teachable,Teachable allows you to create and sell online courses without any technical knowledge from your own website.,Free,app_listing,https://zapier.com/apps/teachable/integrations,2025-07-31,true
SMTP by Zapier,zapier,smtp-by-zapier,SMTP by Zapier,SMTP stands for Simple Mail Transfer Protocol, which is an Internet standard for email transmission available in Microsoft, Google and Yahoo! products among millions of mail servers worldwide.

Check our IMAP service as well!,Free,app_listing,https://zapier.com/apps/smtp-by-zapier/integrations,2025-07-31,true
Wufoo,zapier,wufoo,Wufoo,Wufoo is an easy way to create and manage HTML forms.,Free,app_listing,https://zapier.com/apps/wufoo/integrations,2025-07-31,true
Google Slides,zapier,google-slides,Google Slides,Google Slides allows you to create, edit, and share presentations with anyone, online, for free.,Free,app_listing,https://zapier.com/apps/google-slides/integrations,2025-07-31,true
kvCORE,zapier,kvcore,kvCORE,KvCORE is the next gen solution for modern brokerages, agents, and teams to run their entire business on one platform.,Free,app_listing,https://zapier.com/apps/kvcore/integrations,2025-07-31,true
Facebook Messenger,zapier,facebook-messenger,Facebook Messenger,Facebook Messenger is a messaging app and platform. Users can send messages and exchange photos, videos, stickers, audio, and other files. This app on Zapier works for conversations that are sent to and from Facebook pages and does not yet support direct messages to a user.,Free,app_listing,https://zapier.com/apps/facebook-messenger/integrations,2025-07-31,true
CallRail,zapier,callrail,CallRail,CallRail is an analytics platform designed for those who rely on quality calls and inbound leads to measure success.,Free,app_listing,https://zapier.com/apps/callrail/integrations,2025-07-31,true
beehiiv,zapier,beehiiv,beehiiv,Launch, scale, and monetize your newsletter with a publishing platform built for growth. Built by those who have done it before.,Free,app_listing,https://zapier.com/apps/beehiiv/integrations,2025-07-31,true
GetResponse,zapier,getresponse,GetResponse,With an all-in-one suite of online marketing tools, GetResponse is the perfect solution to help you grow your business.,Free,app_listing,https://zapier.com/apps/getresponse/integrations,2025-07-31,true
PayPal,zapier,paypal,PayPal,PayPal is a fast, safe way to send money, make an online payment, receive money or set up a merchant account. With over 150 million active registered accounts, PayPal helps people and businesses receive and make payments in more than 100 currencies in 203 markets.,Premium,app_listing,https://zapier.com/apps/paypal/integrations,2025-07-31,true
Microsoft SharePoint,zapier,microsoft-sharepoint,Microsoft SharePoint,Microsoft SharePoint is a service that helps organizations share content to quickly find information and seamlessly collaborate.,Premium,app_listing,https://zapier.com/apps/microsoft-sharepoint/integrations,2025-07-31,true
Mighty Networks,zapier,mighty-networks,Mighty Networks,Mighty Networks is a platform that offers anyone the opportunity to create their own community and start getting paid to support their work. Your members can message, meet, and go deeper around the topics and interests they care about most.,Free,app_listing,https://zapier.com/apps/mighty-networks/integrations,2025-07-31,true
SurveyMonkey,zapier,surveymonkey,SurveyMonkey,SurveyMonkey is the easiest way to create surveys and get answers. SurveyMonkey lets you whip up a survey quickly and get targeted answers from the audience you want to ask.,Free,app_listing,https://zapier.com/apps/surveymonkey/integrations,2025-07-31,true
LinkedIn Conversions,zapier,linkedin-conversions,LinkedIn Conversions,LinkedIn Conversions lets you send information about important customer events to LinkedIn's Conversion API directly from your website, CRM or other databases.,Free,app_listing,https://zapier.com/apps/linkedin-conversions/integrations,2025-07-31,true
Linear,zapier,linear,Linear,Linear helps you manage software development processes.,Free,app_listing,https://zapier.com/apps/linear/integrations,2025-07-31,true
ABC Trainerize,zapier,abc-trainerize,ABC Trainerize,ABC Trainerize is a powerful personal training software to grow your business and reach more clients with online personal training, meal planning, in-app communication and workout tracking.,Free,app_listing,https://zapier.com/apps/abc-trainerize/integrations,2025-07-31,true
Digest by Zapier,zapier,digest-by-zapier,Digest by Zapier,Digest captures info from multiple events in your workflows and collects them in a single easily consumed summary that can be sent to any app.,Free,app_listing,https://zapier.com/apps/digest-by-zapier/integrations,2025-07-31,true
Chatwork,zapier,chatwork,Chatwork,Keep your team focused and working together with Chatwork's team chat, tasks, video chats, and more in one place.,Free,app_listing,https://zapier.com/apps/chatwork/integrations,2025-07-31,true
SendGrid,zapier,sendgrid,SendGrid,SendGrid's cloud-based email infrastructure relieves businesses of the cost and complexity of maintaining custom email systems,Free,app_listing,https://zapier.com/apps/sendgrid/integrations,2025-07-31,true
Anthropic (Claude),zapier,anthropic-claude,Anthropic (Claude),Claude by Anthropic is an AI assistant trained for safety and conversational understanding.,Free,app_listing,https://zapier.com/apps/anthropic-claude/integrations,2025-07-31,true
Freshdesk,zapier,freshdesk,Freshdesk,Freshdesk is an online helpdesk software with multiple channel customer service to support customers across email, phone, chat, web, Twitter and more.,Free,app_listing,https://zapier.com/apps/freshdesk/integrations,2025-07-31,true
WebinarJam / EverWebinar,zapier,webinarjam-everwebinar,WebinarJam / EverWebinar,WebinarJam is a webinar and live broadcasting program allowing for live and prerecorded events.,Free,app_listing,https://zapier.com/apps/webinarjam-everwebinar/integrations,2025-07-31,true
Instantly,zapier,instantly,Instantly,Instantly is an email automation platform that helps scale outreach campaigns.,Free,app_listing,https://zapier.com/apps/instantly/integrations,2025-07-31,true
Fillout Forms,zapier,fillout-forms,Fillout Forms,Create powerful forms, surveys and quizzes your audience will answer with Fillout Forms. Store responses directly where you need them.,Free,app_listing,https://zapier.com/apps/fillout-forms/integrations,2025-07-31,true
TidyCal,zapier,tidycal,TidyCal,TidyCal is simple and easy calendar management and booking tool.,Free,app_listing,https://zapier.com/apps/tidycal/integrations,2025-07-31,true
Reddit,zapier,reddit,Reddit,Reddit, stylized as reddit, is a social news and entertainment website where registered users submit content in the form of links or text posts.,Free,app_listing,https://zapier.com/apps/reddit/integrations,2025-07-31,true
Basecamp,zapier,basecamp,Basecamp,Basecamp’s unique blend of tools is everything any team needs to stay on the same page about whatever they’re working on.,Free,app_listing,https://zapier.com/apps/basecamp/integrations,2025-07-31,true
MySQL,zapier,mysql,MySQL,MySQL is a premier database used in millions of production environments around the world. Easily plug your MySQL database into any web service.,Premium,app_listing,https://zapier.com/apps/mysql/integrations,2025-07-31,true
Apollo,zapier,apollo,Apollo,Apollo is a unified engagement platform that is the foundation for your entire end-to-end sales strategy. Teams get access to a database of over 200 million contacts, as well as a host of different engagement and analytics tools.,Free,app_listing,https://zapier.com/apps/apollo/integrations,2025-07-31,true
