id,platform,source_app,title,description,tools_tags,category,url,scraped_date,is_new
Lofty,zapier,lofty,Lofty,Lofty is a product of the technology company Lofty Inc, which offers a complete tech solution for real estate agents.,Free,app_listing,https://zapier.com/apps/lofty/integrations,2025-07-31,true
Stan,zapier,stan,Stan,Designed for Creators to set up their Stan Automations,Free,app_listing,https://zapier.com/apps/stan/integrations,2025-07-31,true
Perspective,zapier,perspective,Perspective,Perspective is a mobile funnel builder which lets you create beautiful mobile experiences.,Free,app_listing,https://zapier.com/apps/perspective/integrations,2025-07-31,true
ClickFunnels,zapier,clickfunnels,ClickFunnels,ClickFunnels gives you everything you need to market, sell, and deliver your products online.,Free,app_listing,https://zapier.com/apps/clickfunnels/integrations,2025-07-31,true
ShipStation,zapier,shipstation,ShipStation,ShipStation helps eCommerce retailers organize, process, and fulfill their orders from all the most popular marketplaces and shopping carts using the top shipping carriers.,Free,app_listing,https://zapier.com/apps/shipstation/integrations,2025-07-31,true
Ninja Forms,zapier,ninja-forms,Ninja Forms,Ninja Forms is the easiest and most flexible WordPress Form builder.,Free,app_listing,https://zapier.com/apps/ninja-forms/integrations,2025-07-31,true
Zoho Forms,zapier,zoho-forms,Zoho Forms,Zoho Forms is a free online form builder that lets you create custom forms, receive responses by email, and collaborate with your team.,Free,app_listing,https://zapier.com/apps/zoho-forms/integrations,2025-07-31,true
Netlify,zapier,netlify,Netlify,Netlify is an all-in-one workflow to build, deploy, and manage modern web projects.,Free,app_listing,https://zapier.com/apps/netlify/integrations,2025-07-31,true
Formidable Forms,zapier,formidable-forms,Formidable Forms,Formidable Forms is a WordPress plugin that helps you create beautiful drag and drop forms with custom styling. You and your visitors can submit and edit entries and posts from the front-end of your site. When you have data, display it with graphs and custom views.,Free,app_listing,https://zapier.com/apps/formidable-forms/integrations,2025-07-31,true
Podio,zapier,podio,Podio,Podio is a collaborative work platform that's perfect for managing projects, teams, and anything else in your business that needs flexible apps that work the way you do.,Free,app_listing,https://zapier.com/apps/podio/integrations,2025-07-31,true
OnceHub,zapier,oncehub,OnceHub,Capture, qualify, and engage with inbound leads using ScheduleOnce, ChatOnce, FormOnce and SubmitOnce.,Free,app_listing,https://zapier.com/apps/oncehub/integrations,2025-07-31,true
Facebook Custom Audiences,zapier,facebook-custom-audiences,Facebook Custom Audiences,Facebook Custom Audiences makes signing up for business information easy for people and more valuable for businesses.,Premium,app_listing,https://zapier.com/apps/facebook-custom-audiences/integrations,2025-07-31,true
Files By Zapier,zapier,files-by-zapier,Files By Zapier,Files by Zapier allows you to import and process files including text, CSV.,Premium,app_listing,https://zapier.com/apps/files-by-zapier/integrations,2025-07-31,true
Zapier Chrome extension,zapier,zapier-chrome-extension,Zapier Chrome extension,Run workflows right from your browser. Include the URL & Title of the current page or add fields to include any other data you want to use in your Zap.,Free,app_listing,https://zapier.com/apps/zapier-chrome-extension/integrations,2025-07-31,true
AWeber,zapier,aweber,AWeber,AWeber provides professional email marketing software and services. AWeber's easy signup forms and autoresponders make it easy for you to stay in touch with your customers.,Free,app_listing,https://zapier.com/apps/aweber/integrations,2025-07-31,true
RD Station,zapier,rd-station,RD Station,RD Station is a complete digital marketing platform to help you generate more results in traffic generation, leads, sales for your business, and to build a solid digital marketing presence.

This app is available only in Portuguese.,Free,app_listing,https://zapier.com/apps/rd-station/integrations,2025-07-31,true
Leadpages,zapier,leadpages,Leadpages,Leadpages lets you build beautiful, high-converting landing pages, sign-up forms, and other conversion assets.,Free,app_listing,https://zapier.com/apps/leadpages/integrations,2025-07-31,true
MailerLite Classic,zapier,mailerlite-classic,MailerLite Classic,Use MailerLite Classic to stay connected with your customers through email marketing. Create websites, landing pages, and forms to grow your audience.,Free,app_listing,https://zapier.com/apps/mailerlite-classic/integrations,2025-07-31,true
Cal.com,zapier,cal-com,Cal.com,Cal.com simplifies scheduling for individuals, teams, and developers with powerful features and integrations that make booking effortless.,Free,app_listing,https://zapier.com/apps/cal-com/integrations,2025-07-31,true
Zoho Mail,zapier,zoho-mail,Zoho Mail,Zoho Mail is a collaborative business communication platform for the modern workforce. It is a blend of classic email and the modern collaboration tools using comments, likes and sharing.,Free,app_listing,https://zapier.com/apps/zoho-mail/integrations,2025-07-31,true
Kommo,zapier,kommo,Kommo,Kommo is a messaging-powered CRM that helps you engage with your customers on a whole new level. It's a versatile, cloud-based sales automation tool that enables you to manage leads and monitor your sales pipeline in only a few clicks.,Free,app_listing,https://zapier.com/apps/kommo/integrations,2025-07-31,true
PLAUD,zapier,plaud,PLAUD,PLAUD is an AI voice recorder and transcription tool that enhances productivity by optimizing speech-to-text conversion and summarizing conversations.,Free,app_listing,https://zapier.com/apps/plaud/integrations,2025-07-31,true
Spotify,zapier,spotify,Spotify,Spotify is a music streaming service that provides digital content from record labels and media companies.,Free,app_listing,https://zapier.com/apps/spotify/integrations,2025-07-31,true
Clio,zapier,clio,Clio,Clio is a practice management platform that helps lawyers work more efficiently by making it easy to do tasks like tracking time, managing matters, and generating invoices.,Free,app_listing,https://zapier.com/apps/clio/integrations,2025-07-31,true
Bark,zapier,bark,Bark,Bark is a world-leading services marketplace with over 5m customers in 6 countries across the globe.,Free,app_listing,https://zapier.com/apps/bark/integrations,2025-07-31,true
Translate by Zapier,zapier,translate-by-zapier,Translate by Zapier,Automatically translates words, phrases, and web pages into over 100 languages.,Free,app_listing,https://zapier.com/apps/translate-by-zapier/integrations,2025-07-31,true
Gumroad,zapier,gumroad,Gumroad,Gumroad allows all types of creators to sell their work (music, art, books, films, etc) directly to their audiences.,Free,app_listing,https://zapier.com/apps/gumroad/integrations,2025-07-31,true
Housecall Pro,zapier,housecall-pro,Housecall Pro,Housecall Pro is a top rated software to run your home service business. We make it easy to schedule, dispatch, estimate, invoice, accept credit cards and get booked online by customers.,Free,app_listing,https://zapier.com/apps/housecall-pro/integrations,2025-07-31,true
Firebase / Firestore,zapier,firebase-firestore,Firebase / Firestore,Firebase Realtime Database and Google Cloud Firestore are flexible databases that give you the ability to easily store and sync app data at global scale.,Free,app_listing,https://zapier.com/apps/firebase-firestore/integrations,2025-07-31,true
Pocket,zapier,pocket,Pocket,Pocket is the best way to save articles, videos and links to view on any device, any time.,Free,app_listing,https://zapier.com/apps/pocket/integrations,2025-07-31,true
Pipefy,zapier,pipefy,Pipefy,The easy button for processes and workflows
Easily organize and run all your processes in one place, leaving the inefficient patchwork of apps, forms, spreadsheets and e-mail threads forever in the past,Free,app_listing,https://zapier.com/apps/pipefy/integrations,2025-07-31,true
Web Parser by Zapier,zapier,web-parser-by-zapier,Web Parser by Zapier,Web Parser parses a given web page and extracts the title and content from it.,Free,app_listing,https://zapier.com/apps/web-parser-by-zapier/integrations,2025-07-31,true
Ghost,zapier,ghost,Ghost,A professional creator platform for publishing content, sending newsletters, and running a subscription business.,Free,app_listing,https://zapier.com/apps/ghost/integrations,2025-07-31,true
Toggl Track,zapier,toggl-track,Toggl Track,Toggl Track provides time tracking and productivity tools to help businesses move away from traditional work models towards flexible and remote work.,Free,app_listing,https://zapier.com/apps/toggl-track/integrations,2025-07-31,true
Onepage,zapier,onepage,Onepage,Onepage helps you build landing pages in minutes.,Free,app_listing,https://zapier.com/apps/onepage/integrations,2025-07-31,true
Pushover,zapier,pushover,Pushover,Pushover is a simple push notification service to instantly send alerts to Android and iOS devices.,Free,app_listing,https://zapier.com/apps/pushover/integrations,2025-07-31,true
Paperform,zapier,paperform,Paperform,A digital Swiss Army Knife: take payments, create forms, manage bookings and put manual processes on autopilot. Where imagination takes form.,Free,app_listing,https://zapier.com/apps/paperform/integrations,2025-07-31,true
PostgreSQL,zapier,postgresql,PostgreSQL,PostgreSQL is a powerful, open-source database engine with a uniquely advanced query optimizer and dozens of built in features, making it an easy choice for production databases.,Premium,app_listing,https://zapier.com/apps/postgresql/integrations,2025-07-31,true
Kartra,zapier,kartra,Kartra,Kartra is an all-in-one solution to manage your online business: checkout, automated email campaigns, site builder, membership portals, etc.,Free,app_listing,https://zapier.com/apps/kartra/integrations,2025-07-31,true
Formstack,zapier,formstack,Formstack,Formstack is one of the easiest ways to build custom forms that let you collect data your way.,Free,app_listing,https://zapier.com/apps/formstack/integrations,2025-07-31,true
Evernote,zapier,evernote,Evernote,Evernote is a powerful note taking application that makes it easy to capture ideas, images, contacts, and anything else you need to remember. Bring your life's work together in one digital workspace—available on all major mobile platforms and devices.

Using Evernote for work? See Evernote Business.,Free,app_listing,https://zapier.com/apps/evernote/integrations,2025-07-31,true
Clockify,zapier,clockify,Clockify,Clockify is a completely free time tracking software for teams. It's a simple time tracker and timesheet app for tracking work hours on projects.,Free,app_listing,https://zapier.com/apps/clockify/integrations,2025-07-31,true
Feedly,zapier,feedly,Feedly,The best way to follow your favorite blogs, news sites, YouTube shows, podcasts, tumblr blogs, magazines, eBay listings, Hulu shows and more. feedly delivers all your favorite news in one place—and it is blazing fast.,Free,app_listing,https://zapier.com/apps/feedly/integrations,2025-07-31,true
Ecwid by Lightspeed,zapier,ecwid-by-lightspeed,Ecwid by Lightspeed,Ecwid by Lightspeed is a cloud online store builder which lets you instantly launch an online store on any website, Facebook page, or multiple sites simultaneously.,Free,app_listing,https://zapier.com/apps/ecwid-by-lightspeed/integrations,2025-07-31,true
Facebook Conversions (for Business admins),zapier,facebook-conversions-for-business-admins,Facebook Conversions (for Business admins),Facebook’s Conversions lets you send information about important customer events to Facebook Server-Side API directly from your website’s server, CRM or other customer information databases. This information is useful to create powerful ads that yield better conversions.,Free,app_listing,https://zapier.com/apps/facebook-conversions-for-business-admins/integrations,2025-07-31,true
Mailparser,zapier,mailparser,Mailparser,Send emails to Mailparser, get structured data in return. Leads, Contact Forms, eCommerce, Shipping Notes, Attachments, Customer Info & more.,Free,app_listing,https://zapier.com/apps/mailparser/integrations,2025-07-31,true
Campaign Monitor,zapier,campaign-monitor,Campaign Monitor,Campaign Monitor is an email marketing tool built for designers. Campaign Monitor makes it easy to send beautiful emails, manage lists and subscribers, and track the results of your campaigns.,Free,app_listing,https://zapier.com/apps/campaign-monitor/integrations,2025-07-31,true
IMAP by Zapier,zapier,imap-by-zapier,IMAP by Zapier,IMAP stands for Internet message access protocol, which is a widely used protocol for e-mail retrieval available in Microsoft, Google and Yahoo! products among millions of mail servers worldwide.

Check our SMTP service as well!,Free,app_listing,https://zapier.com/apps/imap-by-zapier/integrations,2025-07-31,true
Chargebee,zapier,chargebee,Chargebee,Chargebee is a subscription management and recurring billing solution used by businesses to customize subscription billing workflows.,Free,app_listing,https://zapier.com/apps/chargebee/integrations,2025-07-31,true
OneNote,zapier,onenote,OneNote,Microsoft OneNote is a note-taking app that makes it easy to capture and save ideas, images, audio recordings, and anything else you need to remember.,Free,app_listing,https://zapier.com/apps/onenote/integrations,2025-07-31,true
Microsoft Dynamics 365 CRM,zapier,microsoft-dynamics-365-crm,Microsoft Dynamics 365 CRM,Microsoft Dynamics is built for any device, anywhere. Built for you. For Dynamics Version 9 and Dynamics 365.,Premium,app_listing,https://zapier.com/apps/microsoft-dynamics-365-crm/integrations,2025-07-31,true
Attio,zapier,attio,Attio,Attio is the CRM of the future: data-driven, completely customizable and intuitively collaborative.,Free,app_listing,https://zapier.com/apps/attio/integrations,2025-07-31,true
ScoreApp,zapier,scoreapp,ScoreApp,ScoreApp is a quiz builder and lead generation tool for small businesses.,Free,app_listing,https://zapier.com/apps/scoreapp/integrations,2025-07-31,true
Google BigQuery,zapier,google-bigquery,Google BigQuery,BigQuery is Google's serverless and highly scalable enterprise data warehouse, designed to make all your data analysts productive.,Premium,app_listing,https://zapier.com/apps/google-bigquery/integrations,2025-07-31,true
LearnDash,zapier,learndash,LearnDash,LearnDash is a learning management system plugin built for WordPress.,Free,app_listing,https://zapier.com/apps/learndash/integrations,2025-07-31,true
Things,zapier,things,Things,Things is an award-winning personal task manager for Mac and iOS that helps you achieve your goals.,Free,app_listing,https://zapier.com/apps/things/integrations,2025-07-31,true
Givebutter,zapier,givebutter,Givebutter,Givebutter is a fundraising platform that helps you raise money online with donation forms, team fundraising campaigns, and ticketing.,Free,app_listing,https://zapier.com/apps/givebutter/integrations,2025-07-31,true
eBay,zapier,ebay,eBay,eBay is a premier auction site that allows anyone to buy and sell goods, from individuals to retailers.,Free,app_listing,https://zapier.com/apps/ebay/integrations,2025-07-31,true
ServiceM8,zapier,servicem8,ServiceM8,ServiceM8 is a field service app and small business management platform for your computer, iPhone and iPad. Track staff locations, navigate to jobs, and control your estimates, invoicing, scheduling, safety reports, clients & more.,Free,app_listing,https://zapier.com/apps/servicem8/integrations,2025-07-31,true
Jira Service Management,zapier,jira-service-management,Jira Service Management,Jira Service Management is help desk software that enables support agents to receive, track, manage and resolve requests from help seekers.,Free,app_listing,https://zapier.com/apps/jira-service-management/integrations,2025-07-31,true
LearnWorlds,zapier,learnworlds,LearnWorlds,LearnWorlds is a premium learning platform via which you sell online courses under your own website.,Free,app_listing,https://zapier.com/apps/learnworlds/integrations,2025-07-31,true
Wealthbox CRM,zapier,wealthbox-crm,Wealthbox CRM,Wealthbox is a web-based CRM solution that allows financial advisors to manage their client relationships with ease.,Free,app_listing,https://zapier.com/apps/wealthbox-crm/integrations,2025-07-31,true
Pardot,zapier,pardot,Pardot,Pardot is no-hassle marketing automation that makes sales and marketing teams best friends. Increase marketing accountability, gain greater insight into ROI, and much more.,Premium,app_listing,https://zapier.com/apps/pardot/integrations,2025-07-31,true
Zoho Books,zapier,zoho-books,Zoho Books,Zoho Books is cloud-based accounting software in which you can record, audit and analyze all financial transactions easily. With secure data storage, easy navigation and customizable features, Zoho Books provide a head start in accounting for small businesses.,Free,app_listing,https://zapier.com/apps/zoho-books/integrations,2025-07-31,true
Ignition,zapier,ignition,Ignition,Ignition makes it simple to engage clients, get paid and run your business on autopilot. From impressive online proposals to automated engagement letters and payments, we free you up to focus on what matters most.,Free,app_listing,https://zapier.com/apps/ignition/integrations,2025-07-31,true
Amazon S3,zapier,amazon-s3,Amazon S3,Amazon Simple Storage Service is a fully redundant data storage system. It makes it easy to store and retrieve any amount of data, anytime, from anywhere.,Premium,app_listing,https://zapier.com/apps/amazon-s3/integrations,2025-07-31,true
Ontraport,zapier,ontraport,Ontraport,An all-in-one business and marketing platform designed for information marketers, experts, and coaches.,Free,app_listing,https://zapier.com/apps/ontraport/integrations,2025-07-31,true
Adalo,zapier,adalo,Adalo,Adalo is a platform where anyone can create apps without code.,Free,app_listing,https://zapier.com/apps/adalo/integrations,2025-07-31,true
Fello,zapier,fello,Fello,Fello is a marketing automation platform that helps you engage consumers, optimize outreach, and convert more opportunities using AI-driven insights.,Free,app_listing,https://zapier.com/apps/fello/integrations,2025-07-31,true
Mailjet,zapier,mailjet,Mailjet,Mailjet is an all-in-one solution to send, track and deliver transactional, notification and marketing emails.  Engage, analyze and react with your client base through email. Get started by using the Mailjet zap to synchronise contacts from your favorite eCommerce, CRM or other SaaS  tools to your Mailjet contact lists. For users on API version 3 or higher.,Free,app_listing,https://zapier.com/apps/mailjet/integrations,2025-07-31,true
ServiceTitan,zapier,servicetitan,ServiceTitan,ServiceTitan is a mobile, cloud-based software platform that helps home services companies streamline operations, improve customer service, and increase sales.,Free,app_listing,https://zapier.com/apps/servicetitan/integrations,2025-07-31,true
Bigin by Zoho CRM,zapier,bigin-by-zoho-crm,Bigin by Zoho CRM,Bigin is a sales pipeline management software that lets you manage deals, track activities and keep all the interactions with your contacts at one place.,Free,app_listing,https://zapier.com/apps/bigin-by-zoho-crm/integrations,2025-07-31,true
Interact,zapier,interact,Interact,Create quizzes to generate leads with Interact. Send those leads directly into your marketing automation or CRM platform.,Free,app_listing,https://zapier.com/apps/interact/integrations,2025-07-31,true
SamCart,zapier,samcart,SamCart,SamCart is an online shopping cart that helps you sell things online.,Free,app_listing,https://zapier.com/apps/samcart/integrations,2025-07-31,true
BambooHR,zapier,bamboohr,BambooHR,BambooHR is an online human resources software service for small and midsized businesses.,Premium,app_listing,https://zapier.com/apps/bamboohr/integrations,2025-07-31,true
Mailgun,zapier,mailgun,Mailgun,Mailgun is a tool with powerful APIs that allow you to send, receive, track and store email effortlessly. Except, with Zapier you don't have to write any code!,Free,app_listing,https://zapier.com/apps/mailgun/integrations,2025-07-31,true
SQL Server,zapier,sql-server,SQL Server,SQL server (or MS SQL) is a top of the line database geared for the cloud,Premium,app_listing,https://zapier.com/apps/sql-server/integrations,2025-07-31,true
Ticket Tailor,zapier,ticket-tailor,Ticket Tailor,Ticket Tailor is a ticketing platform, offering powerful features, 24/7 support, and industry-leading low fees.,Free,app_listing,https://zapier.com/apps/ticket-tailor/integrations,2025-07-31,true
Bitrix24 CRM,zapier,bitrix24-crm,Bitrix24 CRM,Bitrix24 is a free CRM, project management and collaboration platform used by 10 million teams and available in 18 different languages.,Free,app_listing,https://zapier.com/apps/bitrix24-crm/integrations,2025-07-31,true
Coda,zapier,coda,Coda,Coda is a new type of document that blends the flexibility of documents, the power of spreadsheets, and the utility of apps into a single new canvas.,Free,app_listing,https://zapier.com/apps/coda/integrations,2025-07-31,true
VideoAsk,zapier,videoask,VideoAsk,VideoAsk is a business tool to help your business have meaningful interactions using the proximity of video.,Free,app_listing,https://zapier.com/apps/videoask/integrations,2025-07-31,true
Vimeo,zapier,vimeo,Vimeo,Vimeo is a great tool for storing and distributing video content. It comes with powerful privacy and group features.,Free,app_listing,https://zapier.com/apps/vimeo/integrations,2025-07-31,true
CompanyCam,zapier,companycam,CompanyCam,CompanyCam is an app built for contractors and trades professionals to capture and organize important job site information, including photos and documents. Connecting CompanyCam with other software and CRMs allows users to keep tabs on progress and improve their processes.,Free,app_listing,https://zapier.com/apps/companycam/integrations,2025-07-31,true
SignNow,zapier,signnow,SignNow,SignNow provides a secure and easy electronic signature solution that enables you to sign, send and manage documents anywhere while using any device.,Free,app_listing,https://zapier.com/apps/signnow/integrations,2025-07-31,true
Customer.io,zapier,customer-io,Customer.io,With Customer.io you can send email, SMS, and push based on what people do or don't do in your app.,Free,app_listing,https://zapier.com/apps/customer-io/integrations,2025-07-31,true
Streak,zapier,streak,Streak,Streak is a flexible CRM and process management system that lives inside your Gmail inbox.,Free,app_listing,https://zapier.com/apps/streak/integrations,2025-07-31,true
lemlist,zapier,lemlist,lemlist,lemlist is an outreach email platform with personalized images and videos.,Free,app_listing,https://zapier.com/apps/lemlist/integrations,2025-07-31,true
Copper,zapier,copper,Copper,Copper is a Recommended for Google Workspace CRM that improves productivity and increases visibility across all your customer interactions.,Free,app_listing,https://zapier.com/apps/copper/integrations,2025-07-31,true
Whop,zapier,whop,Whop,Whop is a platform to buy and sell digital products.,Free,app_listing,https://zapier.com/apps/whop/integrations,2025-07-31,true
Zoho Campaigns,zapier,zoho-campaigns,Zoho Campaigns,Zoho Campaigns lets you send email and social media campaigns to your subscribers.,Free,app_listing,https://zapier.com/apps/zoho-campaigns/integrations,2025-07-31,true
JobNimbus,zapier,jobnimbus,JobNimbus,JobNimbus CRM + Project Management for the service industry.,Free,app_listing,https://zapier.com/apps/jobnimbus/integrations,2025-07-31,true
MemberPress,zapier,memberpress,MemberPress,MemberPress is an “all-in-one” membership and LMS plugin for WordPress that will help you generate recurring membership revenue from content like blogs, newsletters, online courses, digital downloads, podcasts, videos, and more.,Free,app_listing,https://zapier.com/apps/memberpress/integrations,2025-07-31,true
CloudConvert,zapier,cloudconvert,CloudConvert,CloudConvert converts files between more than 200 supported formats: documents, image, spreadsheet, presentation, audio, video and more!,Free,app_listing,https://zapier.com/apps/cloudconvert/integrations,2025-07-31,true
Practice Better,zapier,practice-better,Practice Better,Practice Better is a comprehensive solution to help you manage your Health & Wellness practice and the entire client journey with ease, saving you both time and money!,Free,app_listing,https://zapier.com/apps/practice-better/integrations,2025-07-31,true
SimpleTexting,zapier,simpletexting,SimpleTexting,SimpleTexting is a text messaging platform that helps you reach your customers using one of the most effective channels: their text inbox. Send promotions, alerts, polls or reminders to your entire list in a matter of seconds.,Free,app_listing,https://zapier.com/apps/simpletexting/integrations,2025-07-31,true
Box,zapier,box,Box,Box lets you keep all your businesses files in one place for simple online collaboration.,Free,app_listing,https://zapier.com/apps/box/integrations,2025-07-31,true
AgencyZoom,zapier,agencyzoom,AgencyZoom,AgencyZoom is a sales and automation software specifically made for P&C insurance agents.,Free,app_listing,https://zapier.com/apps/agencyzoom/integrations,2025-07-31,true
Wati,zapier,wati,Wati,Wati is an end-to-end customer communication platform on WhatsApp with Team Inbox, No Code Chatbot Builder, Broadcasts & more.,Free,app_listing,https://zapier.com/apps/wati/integrations,2025-07-31,true
Podia,zapier,podia,Podia,Podia is a platform that lets anyone sell memberships, online courses and digital downloads online.,Free,app_listing,https://zapier.com/apps/podia/integrations,2025-07-31,true
