id,platform,source_app,title,description,tools_tags,category,url,scraped_date,is_new
Webhooks by Zapier,zapier,webhooks-by-zapier,Webhooks by Zapier,Webhooks simply POST data (or JSON) to a specific URL every time we see something new. Webhooks can also accept data (or JSON) to kick off a workflow in Zapier.,Premium,app_listing,https://zapier.com/apps/webhooks-by-zapier/integrations,2025-07-31,true
ChatGPT (OpenAI),zapier,chatgpt-openai,ChatGPT (OpenAI),ChatGPT is an AI tool built by OpenAI that enables conversational automation.,Free,app_listing,https://zapier.com/apps/chatgpt-openai/integrations,2025-07-31,true
Google Sheets,zapier,google-sheets,Google Sheets,Create, edit, and share spreadsheets wherever you are with Google Sheets, and get automated insights from your data.,Free,app_listing,https://zapier.com/apps/google-sheets/integrations,2025-07-31,true
Facebook Lead Ads,zapier,facebook-lead-ads,Facebook Lead Ads,Facebook lead ads make signing up for business information easy for people and more valuable for businesses. The Facebook lead ad app is useful for marketers who want to automate actions on their leads.,Premium,app_listing,https://zapier.com/apps/facebook-lead-ads/integrations,2025-07-31,true
HubSpot,zapier,hubspot,HubSpot,HubSpot is your all-in-one stop for all of your marketing software needs.,Free,app_listing,https://zapier.com/apps/hubspot/integrations,2025-07-31,true
Gmail,zapier,gmail,Gmail,One of the most popular email services, Gmail keeps track of all your emails with threaded conversations, tags, and Google-powered search to find any message you need.,Free,app_listing,https://zapier.com/apps/gmail/integrations,2025-07-31,true
Salesforce,zapier,salesforce,Salesforce,Salesforce is a leading enterprise customer relationship manager (CRM) application.,Premium,app_listing,https://zapier.com/apps/salesforce/integrations,2025-07-31,true
Slack,zapier,slack,Slack,Slack is a platform for team communication: everything in one place, instantly searchable, available wherever you go. Offering instant messaging, document sharing and knowledge search for modern teams.,Free,app_listing,https://zapier.com/apps/slack/integrations,2025-07-31,true
Skool,zapier,skool,Skool,Skool is a simple to use community platform that allows you to put your community, course, and event schedule together in one place.,Free,app_listing,https://zapier.com/apps/skool/integrations,2025-07-31,true
Shopify,zapier,shopify,Shopify,Shopify is a simple way to create an online store to list products, collect credit card payments, and ship your goods.,Premium,app_listing,https://zapier.com/apps/shopify/integrations,2025-07-31,true
Klaviyo,zapier,klaviyo,Klaviyo,Klaviyo is an email marketing platform. Powered by data, built for ecommerce and web businesses.,Free,app_listing,https://zapier.com/apps/klaviyo/integrations,2025-07-31,true
Typeform,zapier,typeform,Typeform,Typeform helps you ask awesomely online! If you ever need to run a survey, questionnaire, form, contest etc. Typeform will help you achieve it beautifully across all devices, every time, using its next generation platform.,Free,app_listing,https://zapier.com/apps/typeform/integrations,2025-07-31,true
QuickBooks Online,zapier,quickbooks-online,QuickBooks Online,QuickBooks Online is the web version of the popular accounting packages QuickBooks. Use any Zapier integration to connect QuickBooks Online to hundreds of other apps.,Premium,app_listing,https://zapier.com/apps/quickbooks-online/integrations,2025-07-31,true
Calendly,zapier,calendly,Calendly,Calendly is an elegant and simple scheduling tool for businesses that eliminates email back and forth. It helps save time so that businesses can provide great service and increase sales.,Free,app_listing,https://zapier.com/apps/calendly/integrations,2025-07-31,true
Google Calendar,zapier,google-calendar,Google Calendar,Google Calendar lets you organize your schedule and share events with co-workers and friends. With Google's free online calendar, it's easy to keep track of your daily schedule.,Free,app_listing,https://zapier.com/apps/google-calendar/integrations,2025-07-31,true
Mailchimp,zapier,mailchimp,Mailchimp,Share your ideas with Mailchimp email newsletters—then use its landing page and form builders to grow your lists and take marketing further with drip and transactional emails.,Free,app_listing,https://zapier.com/apps/mailchimp/integrations,2025-07-31,true
Notion,zapier,notion,Notion,A new tool that blends your everyday work apps into one. It's the all-in-one workspace for you and your team.,Free,app_listing,https://zapier.com/apps/notion/integrations,2025-07-31,true
Pipedrive,zapier,pipedrive,Pipedrive,Pipedrive is sales pipeline and CRM software for deal makers. Get super-organized. Close deals in less time. iOS and Android apps let you take your pipeline with you anywhere.,Free,app_listing,https://zapier.com/apps/pipedrive/integrations,2025-07-31,true
Zendesk,zapier,zendesk,Zendesk,Zendesk is a web-based help desk support tool that makes it simple to provide great customer support.,Premium,app_listing,https://zapier.com/apps/zendesk/integrations,2025-07-31,true
ClickUp,zapier,clickup,ClickUp,ClickUp is a productivity platform that allows you to manage your work and personal tasks in a beautifully intuitive environment.,Free,app_listing,https://zapier.com/apps/clickup/integrations,2025-07-31,true
Google Chat,zapier,google-chat,Google Chat,Google Chat is a communication software developed by Google built for teams that provides direct messages and team chat rooms, along with a group messaging function that allows Google Drive content sharing.,Free,app_listing,https://zapier.com/apps/google-chat/integrations,2025-07-31,true
WhatsApp Notifications,zapier,whatsapp-notifications,WhatsApp Notifications,Receive notifications on WhatsApp.,Free,app_listing,https://zapier.com/apps/whatsapp-notifications/integrations,2025-07-31,true
Google Sheets,zapier,google-sheets,Google Sheets,Create, edit, and share spreadsheets wherever you are with Google Sheets, and get automated insights from your data.,Free,app_listing,https://zapier.com/apps/google-sheets/integrations,2025-07-31,true
Gmail,zapier,gmail,Gmail,One of the most popular email services, Gmail keeps track of all your emails with threaded conversations, tags, and Google-powered search to find any message you need.,Free,app_listing,https://zapier.com/apps/gmail/integrations,2025-07-31,true
Filter by Zapier,zapier,filter-by-zapier,Filter by Zapier,Only allow a Zap to proceed when a certain condition is met. For example, if you're sending a text message when you receive a new email, you could use a Filter that only sends a text message when the email received is from a certain address.,Free,app_listing,https://zapier.com/apps/filter-by-zapier/integrations,2025-07-31,true
Formatter by Zapier,zapier,formatter-by-zapier,Formatter by Zapier,Data isn't always in the format you need. Perhaps a date is in International format, but your app needs it in American format. Or maybe you need to Title Case a subject, truncate text for a Tweet, or turn Markdown text into HTML for your blog. Zapier's Formatter tool can help.,Free,app_listing,https://zapier.com/apps/formatter-by-zapier/integrations,2025-07-31,true
Webhooks by Zapier,zapier,webhooks-by-zapier,Webhooks by Zapier,Webhooks simply POST data (or JSON) to a specific URL every time we see something new. Webhooks can also accept data (or JSON) to kick off a workflow in Zapier.,Premium,app_listing,https://zapier.com/apps/webhooks-by-zapier/integrations,2025-07-31,true
Slack,zapier,slack,Slack,Slack is a platform for team communication: everything in one place, instantly searchable, available wherever you go. Offering instant messaging, document sharing and knowledge search for modern teams.,Free,app_listing,https://zapier.com/apps/slack/integrations,2025-07-31,true
Google Calendar,zapier,google-calendar,Google Calendar,Google Calendar lets you organize your schedule and share events with co-workers and friends. With Google's free online calendar, it's easy to keep track of your daily schedule.,Free,app_listing,https://zapier.com/apps/google-calendar/integrations,2025-07-31,true
Schedule by Zapier,zapier,schedule-by-zapier,Schedule by Zapier,Schedule is a native Zapier app you can use for recurring tasks. Trigger an action every day of the month, every day of the week or every single day. You can also select the hour of the day. If you're a developer, this is similar to a crontab, cronjob or cron.,Free,app_listing,https://zapier.com/apps/schedule-by-zapier/integrations,2025-07-31,true
Paths by Zapier,zapier,paths-by-zapier,Paths by Zapier,Conditional logic for your Zapier workflows. Paths let your apps take different actions based on conditions you choose.,Free,app_listing,https://zapier.com/apps/paths-by-zapier/integrations,2025-07-31,true
Email by Zapier,zapier,email-by-zapier,Email by Zapier,Send and receive email via a custom Zapier email address at "zapiermail.com". This is great for triggering off of emails and sending custom emails. (Max of 10 email sends per hour.)

Have direct access to your own email servers? Check out our IMAP and SMTP services!,Free,app_listing,https://zapier.com/apps/email-by-zapier/integrations,2025-07-31,true
Google Drive,zapier,google-drive,Google Drive,Google Drive is Google's file sync app that lets you store all of your files online alongside your Google Docs documents, and keep them synced with all of your devices.,Free,app_listing,https://zapier.com/apps/google-drive/integrations,2025-07-31,true
Delay by Zapier,zapier,delay-by-zapier,Delay by Zapier,Put your Actions on hold for a specified amount of time before sending data to another app. You can set up scheduled emails, get notified of incomplete tasks, send automatic follow-ups, and automate other tasks on your timeline.,Free,app_listing,https://zapier.com/apps/delay-by-zapier/integrations,2025-07-31,true
Code by Zapier,zapier,code-by-zapier,Code by Zapier,Write custom Python or Javascript code in response to any data from any service! Transform, mutate, customize or even do custom HTTP in a native and familiar environment.,Free,app_listing,https://zapier.com/apps/code-by-zapier/integrations,2025-07-31,true
Notion,zapier,notion,Notion,A new tool that blends your everyday work apps into one. It's the all-in-one workspace for you and your team.,Free,app_listing,https://zapier.com/apps/notion/integrations,2025-07-31,true
HubSpot,zapier,hubspot,HubSpot,HubSpot is your all-in-one stop for all of your marketing software needs.,Free,app_listing,https://zapier.com/apps/hubspot/integrations,2025-07-31,true
Google Forms,zapier,google-forms,Google Forms,Google Forms is an easy way to collect data from the web with a simple UI and powerful editor. Works hand-in-hand with Google Sheets!,Free,app_listing,https://zapier.com/apps/google-forms/integrations,2025-07-31,true
Facebook Lead Ads,zapier,facebook-lead-ads,Facebook Lead Ads,Facebook lead ads make signing up for business information easy for people and more valuable for businesses. The Facebook lead ad app is useful for marketers who want to automate actions on their leads.,Premium,app_listing,https://zapier.com/apps/facebook-lead-ads/integrations,2025-07-31,true
Mailchimp,zapier,mailchimp,Mailchimp,Mailchimp is an email and marketing automation platform built for growing businesses. Turn email and SMS into revenue.,Free,app_listing,https://zapier.com/apps/mailchimp/integrations,2025-07-31,true
Calendly,zapier,calendly,Calendly,Calendly is an elegant and simple scheduling tool for businesses that eliminates email back and forth. It helps save time so that businesses can provide great service and increase sales.,Free,app_listing,https://zapier.com/apps/calendly/integrations,2025-07-31,true
ChatGPT (OpenAI),zapier,chatgpt-openai,ChatGPT (OpenAI),ChatGPT is an AI tool built by OpenAI that enables conversational automation.,Free,app_listing,https://zapier.com/apps/chatgpt-openai/integrations,2025-07-31,true
Microsoft Outlook,zapier,microsoft-outlook,Microsoft Outlook,Microsoft Outlook is a web-based suite of webmail, contacts, tasks, and calendaring services.,Free,app_listing,https://zapier.com/apps/microsoft-outlook/integrations,2025-07-31,true
Typeform,zapier,typeform,Typeform,Typeform helps you ask awesomely online! If you ever need to run a survey, questionnaire, form, contest etc. Typeform will help you achieve it beautifully across all devices, every time, using its next generation platform.,Free,app_listing,https://zapier.com/apps/typeform/integrations,2025-07-31,true
Airtable,zapier,airtable,Airtable,Organize anything with Airtable, a modern database created for everyone. Airtable is a fast and flexible way to create tables to keep track of anything, from sales leads to vacation planning to inventory management.,Free,app_listing,https://zapier.com/apps/airtable/integrations,2025-07-31,true
Stripe,zapier,stripe,Stripe,Stripe is a developer-friendly way to accept payments online and in mobile apps. Stripe's suite of APIs powers commerce for thousands of companies of all sizes, processing billions of dollars for businesses each year.,Free,app_listing,https://zapier.com/apps/stripe/integrations,2025-07-31,true
Trello,zapier,trello,Trello,Trello is a team collaboration tool that lets you organize anything and everything to keep your projects on task.,Free,app_listing,https://zapier.com/apps/trello/integrations,2025-07-31,true
RSS by Zapier,zapier,rss-by-zapier,RSS by Zapier,RSS (really simple syndication) is pretty much the industry standard for feed readers. You'll find RSS feeds in almost every app imaginable.,Free,app_listing,https://zapier.com/apps/rss-by-zapier/integrations,2025-07-31,true
LeadConnector,zapier,leadconnector,LeadConnector,LeadConnector is a platform for marketing agencies to manage marketing automation to customer communications and beyond.,Free,app_listing,https://zapier.com/apps/leadconnector/integrations,2025-07-31,true
Discord,zapier,discord,Discord,Discord is an all-in-one voice and text chat for gamers.,Free,app_listing,https://zapier.com/apps/discord/integrations,2025-07-31,true
AI by Zapier,zapier,ai-by-zapier,AI by Zapier,Smart task and text handling powered by a flexible AI. Create text prompts to perform standard tasks like extracting lead (or other) data or answer discrete questions like "where should this message be routed?". Or, create your own!,Premium,app_listing,https://zapier.com/apps/ai-by-zapier/integrations,2025-07-31,true
WhatsApp Notifications,zapier,whatsapp-notifications,WhatsApp Notifications,Receive notifications on WhatsApp.,Free,app_listing,https://zapier.com/apps/whatsapp-notifications/integrations,2025-07-31,true
Looping by Zapier,zapier,looping-by-zapier,Looping by Zapier,Looping by Zapier is a helper app to repeat Action(s) in you Zaps a variable number of times for sets of values.,Free,app_listing,https://zapier.com/apps/looping-by-zapier/integrations,2025-07-31,true
Google Docs,zapier,google-docs,Google Docs,Google Docs is an online word processor that lets you create and format text documents. Collaboratively edit documents with other people in real time.

We also support Google Sheets!,Free,app_listing,https://zapier.com/apps/google-docs/integrations,2025-07-31,true
Zapier Tables,zapier,zapier-tables,Zapier Tables,Zapier Tables is a no-code database built for automation.,Free,app_listing,https://zapier.com/apps/zapier-tables/integrations,2025-07-31,true
Salesforce,zapier,salesforce,Salesforce,Salesforce is a leading enterprise customer relationship manager (CRM) application.,Premium,app_listing,https://zapier.com/apps/salesforce/integrations,2025-07-31,true
Webflow,zapier,webflow,Webflow,Design and build professional websites with a CMS from scratch online with Webflow.,Free,app_listing,https://zapier.com/apps/webflow/integrations,2025-07-31,true
Asana,zapier,asana,Asana,Asana is a leading work management platform that helps teams orchestrate their work, from daily tasks to strategic initiatives. With Asana, organizations have a living system of clarity where everyone can see, discuss, and execute their team’s priorities.,Free,app_listing,https://zapier.com/apps/asana/integrations,2025-07-31,true
Jotform,zapier,jotform,Jotform,The newly redesigned Jotform lets you build forms faster than ever, with powerful widgets and a responsive editor that works offline—without even needing to sign up for an account.,Free,app_listing,https://zapier.com/apps/jotform/integrations,2025-07-31,true
ActiveCampaign,zapier,activecampaign,ActiveCampaign,ActiveCampaign is a customer experience automation (CXA) platform that helps businesses meaningfully engage customers. Access pre-built automations that combine transactional email and email marketing, marketing automation, ecommerce marketing, and CRM for powerful segmentation and personalization across social, email, messaging, chat, and text.,Free,app_listing,https://zapier.com/apps/activecampaign/integrations,2025-07-31,true
monday.com,zapier,monday-com,monday.com,monday.com helps you move projects forward fast, letting everyone know what's been done on a task—and what needs finished right now.,Free,app_listing,https://zapier.com/apps/monday-com/integrations,2025-07-31,true
Gravity Forms,zapier,gravity-forms,Gravity Forms,Gravity Forms is a premier WordPress plugin that makes it easy to create powerful forms on the fly.,Free,app_listing,https://zapier.com/apps/gravity-forms/integrations,2025-07-31,true
ClickUp,zapier,clickup,ClickUp,ClickUp is a productivity platform that allows you to manage your work and personal tasks in a beautifully intuitive environment.,Free,app_listing,https://zapier.com/apps/clickup/integrations,2025-07-31,true
Email Parser by Zapier,zapier,email-parser-by-zapier,Email Parser by Zapier,Send emails to your custom "@robot.zapier.com" address and extract any data! Visit http://parser.zapier.com/ for more information!,Free,app_listing,https://zapier.com/apps/email-parser-by-zapier/integrations,2025-07-31,true
Pipedrive,zapier,pipedrive,Pipedrive,Pipedrive is sales pipeline and CRM software for deal makers. Get super-organized. Close deals in less time. iOS and Android apps let you take your pipeline with you anywhere.,Free,app_listing,https://zapier.com/apps/pipedrive/integrations,2025-07-31,true
Shopify,zapier,shopify,Shopify,Shopify is a simple way to create an online store to list products, collect credit card payments, and ship your goods.,Premium,app_listing,https://zapier.com/apps/shopify/integrations,2025-07-31,true
Squarespace Forms,zapier,squarespace-forms,Squarespace Forms,Squarespace is a website builder, blogging platform, hosting service, commerce platform, and domain name registrar.,Free,app_listing,https://zapier.com/apps/squarespace-forms/integrations,2025-07-31,true
YouTube,zapier,youtube,YouTube,YouTube allows billions of people to discover, watch and share originally-created videos. YouTube provides a forum for people to connect, inform, and inspire others across the globe and acts as a distribution platform for original content creators and advertisers large and small.,Free,app_listing,https://zapier.com/apps/youtube/integrations,2025-07-31,true
Microsoft Excel,zapier,microsoft-excel,Microsoft Excel,Microsoft's Excel is a spreadsheet application used by millions of users across the world. It is part of the Office ecosystem and is considered the industry standard for spreadsheets. 

Only files on OneDrive for Business (available with Office 365 and Sharepoint server) are supported at this time with Zapier.,Free,app_listing,https://zapier.com/apps/microsoft-excel/integrations,2025-07-31,true
Google Ads,zapier,google-ads,Google Ads,Google Ads (formerly Google AdWords) is an online advertising platform developed by Google, where advertisers pay to display brief advertisements, service offerings, product listings, video content, and generate mobile application installs within the Google ad network to web users.,Free,app_listing,https://zapier.com/apps/google-ads/integrations,2025-07-31,true
Zoom,zapier,zoom,Zoom,Zoom brings teams together to get more done in a frictionless environment. Zoom's reliable, video-first unified communications platform provides video meetings, voice, webinars, and chat across desktops, phones, mobile devices, and conference systems,Free,app_listing,https://zapier.com/apps/zoom/integrations,2025-07-31,true
SMS by Zapier,zapier,sms-by-zapier,SMS by Zapier,Using our built-in number, you can send a limited number of SMS / text messages. This is great for reminders!,Free,app_listing,https://zapier.com/apps/sms-by-zapier/integrations,2025-07-31,true
Google Tasks,zapier,google-tasks,Google Tasks,Google Tasks is a very simple task list. Works inside Gmail, Android, and Calendar seamlessly.,Free,app_listing,https://zapier.com/apps/google-tasks/integrations,2025-07-31,true
Google Contacts,zapier,google-contacts,Google Contacts,Google Contacts, the address book built into Gmail, lets you keep track of all your contacts, see when you last interacted with them, and more.,Free,app_listing,https://zapier.com/apps/google-contacts/integrations,2025-07-31,true
Brevo,zapier,brevo,Brevo,Brevo is the leading CRM suite designed to cultivate long-term customer relationships and help businesses grow.,Free,app_listing,https://zapier.com/apps/brevo/integrations,2025-07-31,true
Flodesk,zapier,flodesk,Flodesk,Beginners and experts use Flodesk to create stunning emails that grow their business. Meet the most intuitive way to send emails and build workflows that convert.,Free,app_listing,https://zapier.com/apps/flodesk/integrations,2025-07-31,true
Facebook Pages,zapier,facebook-pages,Facebook Pages,Facebook Pages lets you connect with your customers, fans and followers on the world's largest social network. Share relevant content to engage people who Like your page, create events to build and grow your community, and run a Facebook ad campaign by targeting location, age and more.,Free,app_listing,https://zapier.com/apps/facebook-pages/integrations,2025-07-31,true
Kit,zapier,kit,Kit,Kit is an email marketing platform for professional bloggers. Easily create email sequences, tag subscribers, grow your list, and automate your email marketing.,Free,app_listing,https://zapier.com/apps/kit/integrations,2025-07-31,true
Kajabi,zapier,kajabi,Kajabi,Kajabi is an all in one platform for selling, marketing, and delivering your online content.,Free,app_listing,https://zapier.com/apps/kajabi/integrations,2025-07-31,true
MailerLite,zapier,mailerlite,MailerLite,MailerLite’s super-fast email marketing platform helps you grow your business online using innovative email designs, automations, email segmentation and intuitive no-code tools to create websites, landing pages, and signup forms.,Free,app_listing,https://zapier.com/apps/mailerlite/integrations,2025-07-31,true
Klaviyo,zapier,klaviyo,Klaviyo,Klaviyo is an email marketing platform. Powered by data, built for ecommerce and web businesses.,Free,app_listing,https://zapier.com/apps/klaviyo/integrations,2025-07-31,true
Wix,zapier,wix,Wix,The Wix website builder gives businesses of any size the tools to create, manage and grow a fully integrated and dynamic online presence.,Free,app_listing,https://zapier.com/apps/wix/integrations,2025-07-31,true
Tally,zapier,tally,Tally,The simplest way to create beautiful forms and surveys, for free.,Free,app_listing,https://zapier.com/apps/tally/integrations,2025-07-31,true
QuickBooks Online,zapier,quickbooks-online,QuickBooks Online,QuickBooks Online is the web version of the popular accounting packages QuickBooks. Use any Zapier integration to connect QuickBooks Online to hundreds of other apps.,Premium,app_listing,https://zapier.com/apps/quickbooks-online/integrations,2025-07-31,true
Acuity Scheduling,zapier,acuity-scheduling,Acuity Scheduling,Easy online appointment scheduling software. Save time by having clients book appointments, complete custom intake forms, and pay in advance 24/7 anywhere in the world.,Free,app_listing,https://zapier.com/apps/acuity-scheduling/integrations,2025-07-31,true
Dropbox,zapier,dropbox,Dropbox,Dropbox lets you store your files online, sync them to all your devices, and share them easily. Get started for free, then upgrade for more space and security features.,Free,app_listing,https://zapier.com/apps/dropbox/integrations,2025-07-31,true
Todoist,zapier,todoist,Todoist,Managing millions of tasks, Todoist is an online task management app and todo list. It has Web, iPhone, Android, Chrome, Firefox, Outlook flavors (and more!).,Free,app_listing,https://zapier.com/apps/todoist/integrations,2025-07-31,true
Twilio,zapier,twilio,Twilio,An easy tool for developers to send and receive SMS and voice calls.,Free,app_listing,https://zapier.com/apps/twilio/integrations,2025-07-31,true
Google Business Profile,zapier,google-business-profile,Google Business Profile,Google Business Profile is a platform for businesses to create a Business Profile on Google to help them reach and engage with local customers across Google Search and Maps.,Free,app_listing,https://zapier.com/apps/google-business-profile/integrations,2025-07-31,true
Jira Software Cloud,zapier,jira-software-cloud,Jira Software Cloud,Jira Software Cloud is a bug and issue tracking tool that allows software developers to manage product development. This integration connects to cloud-hosted instances of Jira.,Free,app_listing,https://zapier.com/apps/jira-software-cloud/integrations,2025-07-31,true
WooCommerce,zapier,woocommerce,WooCommerce,WooCommerce is the eCommerce platform for WordPress. This connection requires a paid extension.,Free,app_listing,https://zapier.com/apps/woocommerce/integrations,2025-07-31,true
