id,platform,source_app,title,description,tools_tags,category,url,scraped_date,is_new
Patreon,zapier,patreon,Patreon,Patreon was built to power membership businesses for creators and strives to support creators who wish to gain consistent, sustainable income through their work. Patreon also empowers creators to retain direct contact with their most passionate fans and own creative control of their work.,Free,app_listing,https://zapier.com/apps/patreon/integrations,2025-07-31,true
Process Street,zapier,process-street,Process Street,Process Street is a modern process management platform for teams. We help teams share their core processes, then transform them into powerful no-code workflows.,Free,app_listing,https://zapier.com/apps/process-street/integrations,2025-07-31,true
Instapage,zapier,instapage,Instapage,Instapage is the leader in post-click optimization and maximizes conversions for advertisers and marketers by enabling them to create, optimize, and personalize landing pages at scale.,Free,app_listing,https://zapier.com/apps/instapage/integrations,2025-07-31,true
Instapaper,zapier,instapaper,Instapaper,Instapaper saves web pages to read later on your iPhone, iPad, Android, computer, or Kindle.,Free,app_listing,https://zapier.com/apps/instapaper/integrations,2025-07-31,true
DocSend,zapier,docsend,DocSend,DocSend tells you how prospects engage with your sales material after you send it. Know when to follow up, who to follow up with, and what to focus on, enabling you to do business faster.,Free,app_listing,https://zapier.com/apps/docsend/integrations,2025-07-31,true
Kintone,zapier,kintone,Kintone,kintone is a fully integrated social collaboration and customizable business application cloud platform that allows internal and external teams to solve business process inefficiencies through database and work flow-driven custom apps, communication and collaboration. kintone can be used for custom CRM, Project Mangement, SCM and much more.,Free,app_listing,https://zapier.com/apps/kintone/integrations,2025-07-31,true
Donorbox,zapier,donorbox,Donorbox,Donorbox is a powerful fundraising platform powering 50000+ organizations, it is simple to setup and attracts more recurring donors.,Free,app_listing,https://zapier.com/apps/donorbox/integrations,2025-07-31,true
LiveChat,zapier,livechat,LiveChat,LiveChat is the faster way to contact your customers. It is a web-based chat tool that lets you chat with your website visitors.,Free,app_listing,https://zapier.com/apps/livechat/integrations,2025-07-31,true
SendFox,zapier,sendfox,SendFox,SendFox is an email marketing tool built for content creators.,Free,app_listing,https://zapier.com/apps/sendfox/integrations,2025-07-31,true
BotConversa,zapier,botconversa,BotConversa,BotConversa is a Chatbot builder for WhatsApp. We’ve made it simples for small to big Size businesses to automate their WhatsApp conversations and create a true lead generation machine.,Free,app_listing,https://zapier.com/apps/botconversa/integrations,2025-07-31,true
Wrike,zapier,wrike,Wrike,Wrike is a flexible project management and collaboration platform that enables you to organize your projects, tasks, plans and discussions. It helps you sync your team’s efforts and track your work progress in real time.,Free,app_listing,https://zapier.com/apps/wrike/integrations,2025-07-31,true
SharpSpring,zapier,sharpspring,SharpSpring,Powerful, affordable marketing tools for marketing agencies and SMBs. Features include email automation, lead capture, and a built in CRM system.,Free,app_listing,https://zapier.com/apps/sharpspring/integrations,2025-07-31,true
Little Green Light,zapier,little-green-light,Little Green Light,Little Green Light helps nonprofits run campaigns, manage events, and maintain better constituent records, even from remote locations.,Free,app_listing,https://zapier.com/apps/little-green-light/integrations,2025-07-31,true
Glide,zapier,glide,Glide,Glide gives you the powers of a developer and a designer. Create remarkable tools to solve the business problems you thought you never could.,Free,app_listing,https://zapier.com/apps/glide/integrations,2025-07-31,true
Zendesk Sell,zapier,zendesk-sell,Zendesk Sell,Zendesk Sell (formerly Base) is a sales automation tool to enhance productivity, processes, and pipeline visibility for sales teams.,Free,app_listing,https://zapier.com/apps/zendesk-sell/integrations,2025-07-31,true
WebinarGeek,zapier,webinargeek,WebinarGeek,WebinarGeek is easy-to-use webinar software with marketing tools and analytics.,Free,app_listing,https://zapier.com/apps/webinargeek/integrations,2025-07-31,true
SimplyBook.me,zapier,simplybook-me,SimplyBook.me,SimplyBook.me is online appointment and scheduling software, that allows to accept bookings 24/7 and offers variety of flexible features.,Free,app_listing,https://zapier.com/apps/simplybook-me/integrations,2025-07-31,true
Proposify,zapier,proposify,Proposify,Do more! Proposify let's you connect with thousands of the most popular apps, so you can automate your work and have more time for what matters most—no code required.,Free,app_listing,https://zapier.com/apps/proposify/integrations,2025-07-31,true
Bluesky,zapier,bluesky,Bluesky,Bluesky is a text-based social network.,Premium,app_listing,https://zapier.com/apps/bluesky/integrations,2025-07-31,true
Google Meet,zapier,google-meet,Google Meet,Google Meet is a video conferencing app. Using your browser, share your video, desktop, and presentations with teammates and customers.,Free,app_listing,https://zapier.com/apps/google-meet/integrations,2025-07-31,true
Superchat,zapier,superchat,Superchat,Superchat is a messaging platform that combines relevant communication channels, streamlines customer support and makes messenger marketing accessible to any business.,Free,app_listing,https://zapier.com/apps/superchat/integrations,2025-07-31,true
ConnectWise Manage,zapier,connectwise-manage,ConnectWise Manage,ConnectWise Manage is a business management platform designed to successfully run and grow your technology business.,Free,app_listing,https://zapier.com/apps/connectwise-manage/integrations,2025-07-31,true
Microsoft Exchange,zapier,microsoft-exchange,Microsoft Exchange,Microsoft Exchange Server is a mail server and calendaring server developed by Microsoft.,Free,app_listing,https://zapier.com/apps/microsoft-exchange/integrations,2025-07-31,true
Formsite,zapier,formsite,Formsite,Formsite enables non-technical users to build professional quality web forms and surveys with no HTML or coding experience.,Free,app_listing,https://zapier.com/apps/formsite/integrations,2025-07-31,true
Azure DevOps,zapier,azure-devops,Azure DevOps,Azure DevOps is where teams manage, develop, and deliver software in the cloud. Azure DevOps provides free, private Git project hosting for up to 5 users, project and test management tools, build and CI, and team collaboration. Connect using the development tools of your choice, including Visual Studio, Eclipse, Xcode, and more.,Free,app_listing,https://zapier.com/apps/azure-devops/integrations,2025-07-31,true
Hello Audio,zapier,hello-audio,Hello Audio,HelloAudio.fm is the audio host for digital marketers and course creators to reach their audience where they’re already listening.,Free,app_listing,https://zapier.com/apps/hello-audio/integrations,2025-07-31,true
Sender,zapier,sender,Sender,Capture leads and turn them into loyal customers through Sender, the easy and affordable email & SMS platform.,Free,app_listing,https://zapier.com/apps/sender/integrations,2025-07-31,true
2Chat,zapier,2chat,2Chat,2Chat is a conversational commerce automation tool for WhatsApp, Instagram, Messenger, and SMS.,Free,app_listing,https://zapier.com/apps/2chat/integrations,2025-07-31,true
Outgrow,zapier,outgrow,Outgrow,Outgrow allows you to easily build interactive content like quizzes, calculators, polls, surveys/forms, assessments, chatbots, contests.,Free,app_listing,https://zapier.com/apps/outgrow/integrations,2025-07-31,true
Livestorm,zapier,livestorm,Livestorm,Livestorm is an end-to-end engagement platform that enables you to connect, engage, and capture actionable insights in one place.,Free,app_listing,https://zapier.com/apps/livestorm/integrations,2025-07-31,true
Giphy,zapier,giphy,Giphy,Giphy is the best way to search, share, and discover GIFs on the Internet.,Free,app_listing,https://zapier.com/apps/giphy/integrations,2025-07-31,true
Jotform Enterprise,zapier,jotform-enterprise,Jotform Enterprise,Jotform Enterprise is a digital workplace productivity tool that provides a powerful ROI across your entire organization.,Free,app_listing,https://zapier.com/apps/jotform-enterprise/integrations,2025-07-31,true
Loops,zapier,loops,Loops,Loops is a platform for SaaS companies to send marketing and transactional email.,Free,app_listing,https://zapier.com/apps/loops/integrations,2025-07-31,true
EZ Texting,zapier,ez-texting,EZ Texting,EZ Texting is a text marketing platform to send and receive SMS & MMS via web and mobile apps. Use it for group texts or 1:1 messages.,Free,app_listing,https://zapier.com/apps/ez-texting/integrations,2025-07-31,true
Hostaway,zapier,hostaway,Hostaway,Hostaway is a property management system with a built-in channel manager software that lets you manage hundreds of short-term rentals in real-time in one easy-to-use dashboard and mobile app.,Free,app_listing,https://zapier.com/apps/hostaway/integrations,2025-07-31,true
Popl,zapier,popl,Popl,Popl is a digital business card platform that allows you to share contact info and capture leads.,Free,app_listing,https://zapier.com/apps/popl/integrations,2025-07-31,true
Ko-fi,zapier,ko-fi,Ko-fi,Ko-fi helps creators fund their passions with support from people who love what they do.,Free,app_listing,https://zapier.com/apps/ko-fi/integrations,2025-07-31,true
SafetyCulture,zapier,safetyculture,SafetyCulture,SafetyCulture (formerly iAuditor) is a business platform to conduct inspections, capture issues, manage tasks, communicate clearly and train working teams.,Free,app_listing,https://zapier.com/apps/safetyculture/integrations,2025-07-31,true
Lodgify,zapier,lodgify,Lodgify,Lodgify is a vacation rental software that allows vacation rental managers to create their own website and accept online bookings.,Free,app_listing,https://zapier.com/apps/lodgify/integrations,2025-07-31,true
CINC,zapier,cinc,CINC,CINC is a CRM for top-producing real estate brokers and agents, providing an integrated buyer lead generation and management solution.,Free,app_listing,https://zapier.com/apps/cinc/integrations,2025-07-31,true
respond.io,zapier,respond-io,respond.io,respond.io unifies customer communication across instant messaging, web chat, and email for organizations that market, sell, and support.,Free,app_listing,https://zapier.com/apps/respond-io/integrations,2025-07-31,true
Sierra Interactive,zapier,sierra-interactive,Sierra Interactive,Sierra Interactive is an all-in-one real estate platform that helps you close more deals and grow your business.,Free,app_listing,https://zapier.com/apps/sierra-interactive/integrations,2025-07-31,true
Memberspot,zapier,memberspot,Memberspot,Memberspot is an online course and video-hosting platform.,Free,app_listing,https://zapier.com/apps/memberspot/integrations,2025-07-31,true
ZenMaid,zapier,zenmaid,ZenMaid,ZenMaid is a simple scheduling software for maid services - including automated communication, GPS clock times, payroll, reporting and much more.,Free,app_listing,https://zapier.com/apps/zenmaid/integrations,2025-07-31,true
folk,zapier,folk,folk,folk is the next generation CRM for teams,Free,app_listing,https://zapier.com/apps/folk/integrations,2025-07-31,true
GoTo Webinar,zapier,goto-webinar,GoTo Webinar,GoTo Webinar by LogMeIn makes it easy to set up and deliver an online video and audio conference. Conduct do-it-yourself webinars with up to 1000 people – all for one flat rate. Extend your reach, expand your audience, increase your influence. Webinars work.,Premium,app_listing,https://zapier.com/apps/goto-webinar/integrations,2025-07-31,true
DripJobs,zapier,dripjobs,DripJobs,DripJobs is a Customer Resource Management system designed to help funnel Leads through a strategic process to gain more Jobs and increase revenue.,Free,app_listing,https://zapier.com/apps/dripjobs/integrations,2025-07-31,true
Simpro,zapier,simpro,Simpro,Simpro is a field service and job management software package. Optimize workflow processes & field service operations for trade businesses.,Free,app_listing,https://zapier.com/apps/simpro/integrations,2025-07-31,true
MeisterTask,zapier,meistertask,MeisterTask,MeisterTask is an incredibly intuitive online task manager that uses smart integrations and task automations to make your team more productive.,Free,app_listing,https://zapier.com/apps/meistertask/integrations,2025-07-31,true
123FormBuilder,zapier,123formbuilder,123FormBuilder,123FormBuilder is an easy way to create and use free html forms for your website using their online contact form generator!,Free,app_listing,https://zapier.com/apps/123formbuilder/integrations,2025-07-31,true
GitLab,zapier,gitlab,GitLab,GitLab is an open source code collaboration tool with a rich feature set including management of repositories, reviewing tools, issue tracking, activity feeds and much more.,Free,app_listing,https://zapier.com/apps/gitlab/integrations,2025-07-31,true
Runkeeper,zapier,runkeeper,Runkeeper,Runkeeper lets you track your runs and walks from your mobile device and share the activity with your friends, helping you stick to fitness goals with plans and an encouraging community.,Free,app_listing,https://zapier.com/apps/runkeeper/integrations,2025-07-31,true
Quickbase,zapier,quickbase,Quickbase,Quickbase makes it easy to create custom applications and workflows to streamline processes, with IT visibility and control.,Premium,app_listing,https://zapier.com/apps/quickbase/integrations,2025-07-31,true
Workflowy,zapier,workflowy,Workflowy,Workflowy is the place to collect your ideas, develop them, share them, and turn them into reality.,Free,app_listing,https://zapier.com/apps/workflowy/integrations,2025-07-31,true
bexio,zapier,bexio,bexio,Bexio is a business platform for offering accounting, invoices, payroll, and more for small companies in Switzerland.,Free,app_listing,https://zapier.com/apps/bexio/integrations,2025-07-31,true
PhantomBuster,zapier,phantombuster,PhantomBuster,PhantomBuster is an automation tool for teams to extract lists of leads, enrich data and emails as well as send outreach campaigns.,Free,app_listing,https://zapier.com/apps/phantombuster/integrations,2025-07-31,true
Confluence Cloud,zapier,confluence-cloud,Confluence Cloud,Confluence is where you create, organize and discuss work with your team.

This integration connects to cloud-hosted instances of Confluence. Use the 'Confluence Server' app for server-hosted instances.,Free,app_listing,https://zapier.com/apps/confluence-cloud/integrations,2025-07-31,true
Humanitix,zapier,humanitix,Humanitix,Humanitix is a not-for-profit ticketing platform, in which all booking fees are donated to a charity of the event organiser's choice.,Free,app_listing,https://zapier.com/apps/humanitix/integrations,2025-07-31,true
Better Stack,zapier,better-stack,Better Stack,Better Stack is a tool to provide reliable monitoring with voice calls and beautiful on-call scheduling. Configure everything in just 3 minutes, free plan included!,Free,app_listing,https://zapier.com/apps/better-stack/integrations,2025-07-31,true
Payhip,zapier,payhip,Payhip,Payhip is an e-commerce platform that enables anyone to sell digital products or memberships directly to their fans and followers.,Free,app_listing,https://zapier.com/apps/payhip/integrations,2025-07-31,true
MemberSpace,zapier,memberspace,MemberSpace,MemberSpace allows you to turn any part of your website into members-only with just a few clicks.,Free,app_listing,https://zapier.com/apps/memberspace/integrations,2025-07-31,true
Book Like A Boss,zapier,book-like-a-boss,Book Like A Boss,Book Like A Boss is a powerful scheduling platform that allows you to take appointments, sell your services, and manage your business.,Free,app_listing,https://zapier.com/apps/book-like-a-boss/integrations,2025-07-31,true
Credit Repair Cloud,zapier,credit-repair-cloud,Credit Repair Cloud,Cloud-based Credit Repair Software and CRM. For mortgage brokers and entrepreneurs. Help your clients or start a credit repair business.,Free,app_listing,https://zapier.com/apps/credit-repair-cloud/integrations,2025-07-31,true
BigCommerce,zapier,bigcommerce,BigCommerce,BigCommerce is an e-commerce platform that provides an all-encompassing solution for a business' online store. If you're trying to sell physical goods online, you'll want to check out Bigcommerce.,Premium,app_listing,https://zapier.com/apps/bigcommerce/integrations,2025-07-31,true
Better Proposals,zapier,better-proposals,Better Proposals,Better Proposals is a simple, web-based proposal creation tool that lets you send professionally designed proposals.,Free,app_listing,https://zapier.com/apps/better-proposals/integrations,2025-07-31,true
Boulevard,zapier,boulevard,Boulevard,Boulevard is the first client experience platform purpose-built to accelerate sales and eliminate stress for self-care, appointment-based businesses.,Free,app_listing,https://zapier.com/apps/boulevard/integrations,2025-07-31,true
Moneybird,zapier,moneybird,Moneybird,Moneybird provides cloud accounting for SME's in Holland.,Free,app_listing,https://zapier.com/apps/moneybird/integrations,2025-07-31,true
Booqable,zapier,booqable,Booqable,Booqable is cloud-based rental software to manage your business and accept online bookings.,Free,app_listing,https://zapier.com/apps/booqable/integrations,2025-07-31,true
TeamUp,zapier,teamup,TeamUp,TeamUp manages fitness businesses around the world. This integration is for businesses only.,Free,app_listing,https://zapier.com/apps/teamup/integrations,2025-07-31,true
Curb Hero,zapier,curb-hero,Curb Hero,Curb Hero (formerly Block Party) is a simple, yet powerful, digital Open House sign-in app + property marketing tool used by thousands of real estate agents and mortgage professionals. It's proven to save time and get better quality lead data. 
Using Curb Hero subscription-free app, Realtors can quickly create a digital open house sign-in that is a showcase for their brand. Their logo, photos, color palette, lead questions, and follow-up messaging are all customizable. Curb Hero's Zapier integration can be used to unlock infinite possibilities with the data collected at open houses or in property marketing!,Free,app_listing,https://zapier.com/apps/curb-hero/integrations,2025-07-31,true
Synthflow AI,zapier,synthflow-ai,Synthflow AI,Synthflow AI is a scalable no-code platform enabling non-tech users and SMEs to create custom LLM solutions using their own data and ideas.,Free,app_listing,https://zapier.com/apps/synthflow-ai/integrations,2025-07-31,true
Odoo ERP Self Hosted,zapier,odoo-erp-self-hosted,Odoo ERP Self Hosted,Odoo ERP Self Hosted (formerly known as OpenERP) is a powerful open source platform with dozens of apps to help you grow your business. Available apps range from CRM to eCommerce, and from accounting to manufacturing and project management. This Odoo ERP Self Hosted integration works with all of Odoo ERP's products. It works with instances that are self-hosted.,Free,app_listing,https://zapier.com/apps/odoo-erp-self-hosted/integrations,2025-07-31,true
SendPulse,zapier,sendpulse,SendPulse,SendPulse is an Integrated messaging platform providing user communication on all devices with Emails, SMS, Web Push, SMTP and more.,Free,app_listing,https://zapier.com/apps/sendpulse/integrations,2025-07-31,true
Uscreen,zapier,uscreen,Uscreen,Uscreen is a fully hosted video platform enabling you to sell and distribute your videos online.,Free,app_listing,https://zapier.com/apps/uscreen/integrations,2025-07-31,true
Pushbullet,zapier,pushbullet,Pushbullet,Pushbullet makes it easy to push notifications to your smartphone and computer from the web. These notifications are smart too: if you receive a notification with a link, tapping on the notification will take you right to it!,Free,app_listing,https://zapier.com/apps/pushbullet/integrations,2025-07-31,true
Sunsama,zapier,sunsama,Sunsama,Sunsama organizes all your tasks, to-dos, and meetings day-by-day. Manage all the work you need to do today in one place.,Free,app_listing,https://zapier.com/apps/sunsama/integrations,2025-07-31,true
OptinMonster,zapier,optinmonster,OptinMonster,Powerful lead generation software that converts abandoning visitors into subscribers with dynamic marketing tools and Exit Intent® technology.,Free,app_listing,https://zapier.com/apps/optinmonster/integrations,2025-07-31,true
Grain,zapier,grain,Grain,Grain joins your calls to take notes, document the next steps, and file automated meeting notes in platforms like Slack, HubSpot, and more.,Free,app_listing,https://zapier.com/apps/grain/integrations,2025-07-31,true
pdfFiller,zapier,pdffiller,pdfFiller,pdfFiller is an online PDF editor, form builder and eSignature solution that makes it fast, easy and secure to manage your documents on any computer or mobile device.,Free,app_listing,https://zapier.com/apps/pdffiller/integrations,2025-07-31,true
NiceJob,zapier,nicejob,NiceJob,NiceJob is a platform that helps you get more customer reviews and build a great reputation online.,Free,app_listing,https://zapier.com/apps/nicejob/integrations,2025-07-31,true
Affinity,zapier,affinity,Affinity,Affinity is a collective intelligence CRM, helping you keep track of the people and organizations in your network.,Free,app_listing,https://zapier.com/apps/affinity/integrations,2025-07-31,true
Formstack Documents,zapier,formstack-documents,Formstack Documents,Introducing Formstack Documents, formerly WebMerge. Automatically generate PDF and Word DOCX documents merged with data from online web services. Contracts, invoices, applications, tickets, and more - all created dynamically, saving you time and money.,Free,app_listing,https://zapier.com/apps/formstack-documents/integrations,2025-07-31,true
FunnelCockpit,zapier,funnelcockpit,FunnelCockpit,FunnelCockpit is your all-in-one marketing solution.,Free,app_listing,https://zapier.com/apps/funnelcockpit/integrations,2025-07-31,true
umsatz.io,zapier,umsatz-io,umsatz.io,umsatz.io is a CRM system that helps businesses to make more sales.,Free,app_listing,https://zapier.com/apps/umsatz-io/integrations,2025-07-31,true
LeadSimple,zapier,leadsimple,LeadSimple,LeadSimple is the CRM that property management and real estate companies use to scale and grow.,Free,app_listing,https://zapier.com/apps/leadsimple/integrations,2025-07-31,true
HeyGen,zapier,heygen,HeyGen,Meet HeyGen - The best AI video generation platform for your team.,Free,app_listing,https://zapier.com/apps/heygen/integrations,2025-07-31,true
Proof,zapier,proof,Proof,Proof is a marketing platform that displays recent signups, purchases, and other activity on your website.,Free,app_listing,https://zapier.com/apps/proof/integrations,2025-07-31,true
MyCase,zapier,mycase,MyCase,MyCase is legal case management software for unparalleled productivity.,Free,app_listing,https://zapier.com/apps/mycase/integrations,2025-07-31,true
iClosed,zapier,iclosed,iClosed,iClosed is a sales analytics & scheduler platform that helps you scale your business.,Free,app_listing,https://zapier.com/apps/iclosed/integrations,2025-07-31,true
Shippo,zapier,shippo,Shippo,Shippo provides a multi-carrier API and dashboard to help merchants and platforms get real-time rates, print labels, automate international paperwork, track packages and facilitate returns. Shippo provides the platform to help businesses succeed through shipping.,Free,app_listing,https://zapier.com/apps/shippo/integrations,2025-07-31,true
Recruitee,zapier,recruitee,Recruitee,Recruitee is an all-in-one hiring platform for teams of all sizes, that includes employer branding, job promoting, talent sourcing, and applicant tracking.,Free,app_listing,https://zapier.com/apps/recruitee/integrations,2025-07-31,true
Membership.io,zapier,membership-io,Membership.io,Membership.io is a platform that helps creators build and scale their membership sites.,Free,app_listing,https://zapier.com/apps/membership-io/integrations,2025-07-31,true
Salesmsg,zapier,salesmsg,Salesmsg,Salesmsg is a two-way text messaging software to allows you to send and receive text messages online from real local phone numbers.,Free,app_listing,https://zapier.com/apps/salesmsg/integrations,2025-07-31,true
Swipe Pages,zapier,swipe-pages,Swipe Pages,Swipe Pages helps you create & publish landing pages without code.,Free,app_listing,https://zapier.com/apps/swipe-pages/integrations,2025-07-31,true
POWR Form Builder,zapier,powr-form-builder,POWR Form Builder,POWR Form Builder is an easy way to collect information, grow your email list, and take payments online on all devices and platforms.,Free,app_listing,https://zapier.com/apps/powr-form-builder/integrations,2025-07-31,true
Short.io,zapier,short-io,Short.io,Short.io is a white label link shortener, which allows you to create short links on your own domain.,Free,app_listing,https://zapier.com/apps/short-io/integrations,2025-07-31,true
Docparser,zapier,docparser,Docparser,Docparser converts your PDF documents into structured and easy-to-handle data. With Docparser you can pull out specific data fields (e.g. Purchase Order Number, Date, Shipping Address, ...) and tabular data from your documents.,Free,app_listing,https://zapier.com/apps/docparser/integrations,2025-07-31,true
Voicenotes,zapier,voicenotes,Voicenotes,Voicenotes is a place to dump your thoughts,Free,app_listing,https://zapier.com/apps/voicenotes/integrations,2025-07-31,true
